Client,Title,Artist,Date,Time,Target,Type,Category
Mousetrap Heart Events, Thirsty Merc in the Summertime, Thirsty Merc, 20/12/2024, 8:00pm,2000, gig, indoor
Party People United, New Years Eve Rock and Dance Gigs, Various local musicians, 31/12/2024, 8:00pm,1000,gig, indoor
Party People United, BBQ and Udon Winter Festival, Jap Jazz, 1/6/2024, 12:00pm,4000, gig, outdoor
Macca Production, World Peace for Yoko, Paul McCartney, 2/2/2025, 12:00pm,35000, large live concert, outdoor
Taytay Production, 1989 Tour Again, Taylor Swift, 5/4/2025, 7:30pm,90000, large live concert, convertible
KPOP by Melbournian,KPOP in Windy Winter Morning,BTS,15/7/2024,9:00am,2400,gig,indoor
